{"contract_version":"1.0","submission_id":"KA-IN-000010","items":[{"article_id":"KA-ART-000012","input_mode":"pdf_single","filename":"tc5_second.pdf","validation_status":"valid","duplicate_status":"duplicate","duplicate_of":"KA-ART-000011","metadata":{"doi":"10.1234/test.doi-dup"},"status":"duplicate_existing"}],"summary":{"total":1,"staged":0,"duplicates":1,"rejected":0,"edge_cases":0}}