{"contract_version":"1.0","submission_id":"KA-IN-000001","items":[{"article_id":"KA-ART-000001","input_mode":"pdf_single","filename":"Building_Environment.pdf","validation_status":"valid","duplicate_status":"not_duplicate","metadata":{"doi":null,"confidence":"low"},"status":"staged_pending_review","a0_task":null,"article_type":null,"counts_toward_requirement":true,"reason":null,"classifier":{"verdict":"accept","classifier_article_type":"meta_analysis","article_type_confidence":0.57,"primary_topic":"Biophilia","primary_topic_confidence":1.0,"overall_confidence":0.82,"next_action":"ready_for_downstream_extraction","backend":"atlas_shared","active_topic_matches":[]}}],"summary":{"total":1,"staged":1,"duplicates":0,"rejected":0,"edge_cases":0}}
