{"contract_version":"1.0","submission_id":"KA-IN-000003","items":[{"article_id":"KA-ART-000003","input_mode":"pdf_single","filename":"Symbolic_Interaction_Theory_and_Architecture.pdf","validation_status":"valid","duplicate_status":"not_duplicate","metadata":{"doi":null,"confidence":"low"},"status":"needs_review","a0_task":null,"article_type":null,"counts_toward_requirement":true,"reason":"next_action:review_borderline_case","classifier":{"verdict":"reject","classifier_article_type":"unknown","article_type_confidence":0.15,"primary_topic":null,"primary_topic_confidence":0.0,"overall_confidence":0.88,"next_action":"review_borderline_case","backend":"atlas_shared","active_topic_matches":[]}}],"summary":{"total":1,"staged":0,"duplicates":0,"rejected":0,"edge_cases":1}}
