{"contract_version":"1.0","submission_id":"KA-IN-000006","items":[{"article_id":"KA-ART-000006","input_mode":"pdf_single","filename":"Building_Environment.pdf","validation_status":"valid","duplicate_status":"duplicate","duplicate_of":"KA-ART-000001","metadata":{"doi":null},"status":"duplicate_existing"}],"summary":{"total":1,"staged":0,"duplicates":1,"rejected":0,"edge_cases":0}}