{"contract_version":"1.0","submission_id":"KA-IN-000002","items":[{"article_id":"KA-ART-000002","input_mode":"pdf_single","filename":"Cell_Reports_Methods.pdf","validation_status":"valid","duplicate_status":"not_duplicate","metadata":{"doi":null,"confidence":"low"},"status":"rejected_off_topic","a0_task":null,"article_type":null,"counts_toward_requirement":true,"reason":"off_topic:edge_case_with_weak_topic_match_0.26_below_0.4","classifier":{"verdict":"edge_case","classifier_article_type":"commentary","article_type_confidence":0.57,"primary_topic":"Color Psychology","primary_topic_confidence":0.26,"overall_confidence":0.58,"next_action":"review_borderline_case","backend":"atlas_shared","active_topic_matches":[]}}],"summary":{"total":1,"staged":0,"duplicates":0,"rejected":1,"edge_cases":0}}
