{"contract_version":"1.0","submission_id":"KA-IN-000004","items":[{"article_id":"KA-ART-000004","input_mode":"citation_text","citation":"Granovskii, M., Dincer, I., & Rosen, M. A. (2006). Economic and environmental comparison of conventional, hybrid, electric and hydrogen fuel cell vehicles. Journal of Power Sources, 159(2), 1186-1193.","validation_status":"accepted","duplicate_status":"not_duplicate","metadata":{"doi":null},"status":"needs_review","reason":"citation_only_no_pdf_text","classifier":{"verdict":null,"classifier_article_type":"unknown","article_type_confidence":0.0,"primary_topic":null,"primary_topic_confidence":0.0,"overall_confidence":0.0,"next_action":"need_abstract_or_keywords","backend":"atlas_shared","active_topic_matches":[]}}],"summary":{"total":1,"staged":0,"duplicates":0,"rejected":0,"edge_cases":1}}
