{"contract_version":"1.0","submission_id":"KA-IN-000009","items":[{"article_id":"KA-ART-000011","input_mode":"pdf_single","filename":"tc5_first.pdf","validation_status":"valid","duplicate_status":"not_duplicate","metadata":{"doi":"10.1234/test.doi-dup","confidence":"medium"},"status":"needs_review","a0_task":null,"article_type":null,"counts_toward_requirement":true,"reason":"insufficient_text_for_classification","classifier":{"verdict":null,"classifier_article_type":"unknown","article_type_confidence":0.0,"primary_topic":null,"primary_topic_confidence":0.0,"overall_confidence":0.0,"next_action":"need_abstract_or_keywords","backend":"atlas_shared","active_topic_matches":[]}}],"summary":{"total":1,"staged":0,"duplicates":0,"rejected":0,"edge_cases":1}}