{"contract_version":"1.0","submission_id":"KA-IN-000008","items":[{"article_id":"KA-ART-000008","input_mode":"pdf_single","filename":"Cross-Sectional_Study_of_a_biophilic_building.pdf","validation_status":"valid","duplicate_status":"not_duplicate","metadata":{"doi":null,"confidence":"low"},"status":"needs_review","a0_task":null,"article_type":null,"counts_toward_requirement":true,"reason":"next_action:review_borderline_case","classifier":{"verdict":"edge_case","classifier_article_type":"case_study","article_type_confidence":0.57,"primary_topic":"Biophilia","primary_topic_confidence":0.58,"overall_confidence":0.72,"next_action":"review_borderline_case","backend":"atlas_shared","active_topic_matches":[]}},{"article_id":"KA-ART-000009","input_mode":"pdf_single","filename":"fake.pdf","validation_status":"invalid","duplicate_status":"not_checked","metadata":{},"status":"rejected_bad_file","reason":"Not a PDF file (invalid magic bytes)"},{"article_id":"KA-ART-000010","input_mode":"pdf_single","filename":"Building_Environment.pdf","validation_status":"valid","duplicate_status":"duplicate","duplicate_of":"KA-ART-000001","metadata":{"doi":null},"status":"duplicate_existing"}],"summary":{"total":3,"staged":0,"duplicates":1,"rejected":1,"edge_cases":1}}